番号,開催日,終了日,イベント等名,会場,開催等状況,ホームページURL,問い合わせ先,電話番号,備考,,__1
1,2020-03-01,当面の間,司法書士相談,市民の声を聞く課・各区役所,中止,"http://www.city.sapporo.jp/somu/shiminnokoe/sakusei/soudan.html,http://www.city.sapporo.jp/somu/shiminnokoe/sakusei/soudan_shiminnokoe.html",総務局広報部市民の声を聞く課,011-211-2042,,,
2,2020-03-03,当面の間,家庭生活相談,市民の声を聞く課・各区役所,電話相談のみ受付（面談相談休止中）,"http://www.city.sapporo.jp/somu/shiminnokoe/sakusei/soudan.html,http://www.city.sapporo.jp/somu/shiminnokoe/sakusei/soudan_shiminnokoe.html",総務局広報部市民の声を聞く課,011-211-2042,,,
3,2020-04-13,当面の間,法律相談,市民の声を聞く課・各区役所,"【市民の声を聞く課】電話相談のみ受付（面談相談休止）,【各区役所】,全面休止","http://www.city.sapporo.jp/somu/shiminnokoe/sakusei/soudan.html,http://www.city.sapporo.jp/somu/shiminnokoe/sakusei/soudan_shiminnokoe.html",総務局広報部市民の声を聞く課,011-211-2042,,,
4,2020-04-21,当面の間,税相談,市民の声を聞く課,電話相談のみ受付（面談相談休止中）,http://www.city.sapporo.jp/somu/shiminnokoe/sakusei/soudan_shiminnokoe.html,総務局広報部市民の声を聞く課,011-211-2042,,,
5,2020-05-13,2021-03-31,ポロップひろば,市立幼稚園全園,"中止,（７月末まで）",http://www.higashinaebo-k.sapporo-c.ed.jp/,教育委員会学校教育部幼児教育センター担当課,011-671-3454,,,
6,2020-05-13,12月16日（毎週水曜日）,清田区民シニアスクール,三里塚小学校ほか,中止,http://www.city.sapporo.jp/kiyota/chiiki-shinko/shinia/shinia.html,清田区地域振興課,011-889-2024,,,
7,2020-05-26,2021-03-31,特定健診（実施医療機関）,実施医療機関,"5月26日から,再開",http://www.city.sapporo.jp/hoken-iryo/kokuho/kensin4.html#iryoukikan,保健福祉局保険医療部国保健康推進担当課,011-211-2887,,,
8,2020-05-26,2021-03-31,後期高齢者健診（実施医療機関）,実施医療機関,"5月26日から,再開",http://www.city.sapporo.jp/hoken-iryo/rouken/kokikorei_kensin.html,保健福祉局保険医療部国保健康推進担当課,011-211-2887,,,
9,2020-05-26,2021-03-31,特定保健指導,各区保健センター・各区役所保健福祉課・実施医療機関等,"5月26日から,再開",http://www.city.sapporo.jp/hoken-iryo/kokuho/hoken_shido.html,保健福祉局保険医療部国保健康推進担当課,011-211-2887,,,
10,2020-07-01,2021-12-01,札幌市手話通訳者養成講座,視聴覚障がい者情報センター,開催,http://www.city.sapporo.jp/shogaifukushi/communication/syuwayousei.html,札幌聴覚障害者協会,011-633-7575,,,
11,2020-07-06,2020-11-09,札幌市手話講習会,オンライン,開催,http://www.city.sapporo.jp/shogaifukushi/communication/syuwakousyu.html,札幌聴覚障害者協会,011-633-7575,,,
12,2020-08-08,2020-01-31,WEB企画展さっぽろいきものがたり,Web開催,Web開催,http://www.sapporo-conservation.net,環境局環境都市推進部環境共生担当課,011-211-2879,,,
13,2020-08-27,2021-01-21,"ファイナンシャルプランナー（FP）2級,（就業支援講習会）",札幌市ひとり親家庭支援センター,開催,"http://kosodate.city.sapporo.jp/mokuteki/manabu/hitorioya/1343.html,http://satsuboren.or.jp/hitorioya/",子ども未来局子育て支援部子育て支援課,011-211-2988,,,
14,2020-09-15,2021-02-25,"簿記2級,（就業支援講習会）",札幌市ひとり親家庭支援センター,開催,"http://kosodate.city.sapporo.jp/mokuteki/manabu/hitorioya/1343.html,http://satsuboren.or.jp/hitorioya/",子ども未来局子育て支援部子育て支援課,011-211-2988,,,
15,2020-10-14,2020-03-05,"医療事務講習会,（就業支援講習会）",札幌市ひとり親家庭支援センター,開催,"http://kosodate.city.sapporo.jp/mokuteki/manabu/hitorioya/1343.html,http://satsuboren.or.jp/hitorioya/",子ども未来局子育て支援部子育て支援課,011-211-2988,,,
16,2020-10-26,2020-02-03,"ワード・エクセル準2級,（就業支援講習会）",札幌市ひとり親家庭支援センター,開催,"http://kosodate.city.sapporo.jp/mokuteki/manabu/hitorioya/1343.html,http://satsuboren.or.jp/hitorioya/",子ども未来局子育て支援部子育て支援課,011-211-2988,,,
17,2020-10-29,2020-12-24,"仕事力・マナー技能検定3級,（就業支援講習会）",札幌市ひとり親家庭支援センター,開催,"http://kosodate.city.sapporo.jp/mokuteki/manabu/hitorioya/1343.html,http://satsuboren.or.jp/hitorioya/",子ども未来局子育て支援部子育て支援課,011-211-2988,,,
18,2020-11-17,2020-12-28,行政相談,各区役所,中止,http://www.city.sapporo.jp/somu/shiminnokoe/sakusei/soudan.html,総務局広報部市民の声を聞く課,011-211-2042,,,
19,2020-11-20,2020-12-25,第19回ミュンヘン・クリスマス市 in Sapporo,大通公園,中止,https://white-illumination.jp/munich/,さっぽろホワイトイルミネーション実行委員会,011-281-6400,,,
20,2020-11-20,2020-12-25,"第40回さっぽろホワイトイルミネーション,（大通会場）",大通公園,開催,https://white-illumination.jp/,さっぽろホワイトイルミネーション実行委員会,011-281-6400,,,
21,2020-11-20,2020-02-11,"第40回さっぽろホワイトイルミネーション,（駅前通会場）",札幌駅前通（北4条～南4条）,開催,https://white-illumination.jp/,さっぽろホワイトイルミネーション実行委員会,011-281-6400,,,
22,2020-11-20,2020-03-14,"第40回さっぽろホワイトイルミネーション,（南一条通会場、北3条広場会場、札幌駅南口駅前広場会場）","南一条通（南1条西1～3丁目）、,北3条広場（アカプラ）、,札幌駅南口駅前広場",開催,https://white-illumination.jp/,さっぽろホワイトイルミネーション実行委員会,011-281-6400,,,
23,2020-11-25,当面の間,人権相談,市民の声を聞く課,電話相談のみ受付（面談相談休止中）,http://www.city.sapporo.jp/somu/shiminnokoe/sakusei/soudan_shiminnokoe.html,総務局広報部市民の声を聞く課,011-211-2042,,,
24,2020-11-26,2020-12-22,図書展示「読む！聴く！クラシック」,東札幌図書館１階図書室,開催予定,http://www.city.sapporo.jp/toshokan/gyoji/h-sapporo/h-sapporo.html,東札幌図書館,011-824-2801,,,
25,2020-11-26,当面の間,不動産相談（取引・賃貸など）,市民の声を聞く課,中止,http://www.city.sapporo.jp/somu/shiminnokoe/sakusei/soudan_shiminnokoe.html,総務局広報部市民の声を聞く課,011-211-2042,,,
26,2020-12-01,2020-12-27,リユースプラザ：食卓イスフェア,リユースプラザ,開催,http://www.reuseplaza.jp/,環境局環境事業部循環型社会推進課,011-211-2928,,,
27,2020-12-03,2020-01-05,干支展,円山動物園情報ホール,開催,,環境局円山動物園飼育展示課,011-621-1426,,,
28,2020-12-03,当面の間,不動産相談（価格など）,市民の声を聞く課,中止,http://www.city.sapporo.jp/somu/shiminnokoe/sakusei/soudan_shiminnokoe.html,総務局広報部市民の声を聞く課,011-211-2042,,,
29,2020-12-08,2020-12-24,ステップ出張相談会,ハローワークほか,開催,https://www.career-bank.co.jp/job/other/project/toyohira.html,保健福祉局総務部保護自立支援課,011-211-2992,,,
30,2020-12-19,2020-02-14,札幌国際芸術祭2020,札幌芸術の森、モエレ沼公園ほか,中止,http://siaf.jp/,札幌国際芸術祭実行委員会事務局,011-211-2314,,,
31,2020-12-19,2020-02-14,札幌ミュージアム・アート・フェア2020-21,札幌芸術の森美術館、本郷新記念札幌彫刻美術館,開催,https://artpark.or.jp/tenrankai-event/artfair2020-21/,札幌芸術の森美術館,011-591-0090,本郷新記念札幌彫刻美術館 011-642-5709,,
32,2020-12-23,,さっぽろん札幌解体新書～札幌最新動向～,オンライン,開催予定,http://sapporo-iju.jp/,株式会社パソナテック　東日本支社　札幌支店,011-252-3381,,,
33,2020-12-24,2020-12-26,リサイクルプラザ宮の沢市民交流広場,リサイクルプラザ宮の沢,開催,http://www.sapporo530.or.jp/,環境局環境事業部循環型社会推進課,011-211-2928,,,
34,2020-12-24,,リサイクルプラザ宮の沢12月のエコ教室（簡単！包丁研ぎ）,リサイクルプラザ宮の沢,中止,http://www.sapporo530.or.jp/,環境局環境事業部循環型社会推進課,011-211-2928,,,
35,2020-12-25,,リサイクルプラザ宮の沢12月のエコ教室（ダンボール式生ごみ堆肥化）,リサイクルプラザ宮の沢,開催,http://www.sapporo530.or.jp/,環境局環境事業部循環型社会推進課,011-211-2928,,,
36,2020-12-26,,シットスキーサポーター講習会,中島体育センター,開催予定,https://www.city.sapporo.jp/sports/syogai/event/r2sitski-biski-seminar.html,スポーツ局スポーツ部企画事業課,011-211-3044,,,
37,2020-12-26,,おはなし会,厚別図書館,開催予定,http://www.city.sapporo.jp/toshokan/kids/gyoji/atubetu/atubetu.html,厚別図書館,011-894-1590,,,
38,2020-12-26,,おはなし会,曙図書館第1集会室,開催予定,http://www.city.sapporo.jp/toshokan/gyoji/akebono/akebono.html,曙図書館,011-685-4946,,,
39,2020-12-26,,お話の会,新琴似図書館2階おはなし室,開催予定,http://www.city.sapporo.jp/toshokan/kids/gyoji/sinkotoni/sinkotoni.html,新琴似図書館,011-765-1901,,,
40,2020-12-27,,サンデーサロン,ちあふる・あつべつ,開催,,子）子育て支援部厚別区保育・子育て支援センター,011-887-8166,,,
41,2020-12-27,,子どもの一日飼育係,円山動物園,開催予定,,環境局円山動物園飼育展示課,011-621-1426,,,
42,2020-12-28,,子どもの一日飼育係,円山動物園,開催予定,,環境局円山動物園飼育展示課,011-621-1426,,,
43,2020-01-05,2020-01-15,リサイクルプラザ宮の沢学習机フェア,リサイクルプラザ宮の沢,開催,http://www.sapporo530.or.jp/,環境局環境事業部循環型社会推進課,011-211-2928,,,
44,2020-01-05,2020-01-31,リユースプラザ：タンスフェア,リユースプラザ,開催,http://www.reuseplaza.jp/,環境局環境事業部循環型社会推進課,011-211-2928,,,
45,2020-01-06,,令和3年札幌市消防出初式,カナモトホール,中止,https://www.city.sapporo.jp/shobo/event/top.html,消防局総務部総務課,011-215-2010,,,
46,2021-01-06,,さっぽろん札幌解体新書～フリーランス～,オンライン,開催予定,http://sapporo-iju.jp/,株式会社パソナテック　東日本支社　札幌支店,011-252-3381,,,
47,2020-01-07,,子育てスノーフェスタ,札幌市向陵中学校,中止,,中央区保健福祉部健康・子ども課,,,,
48,2020-01-07,,子どもの一日飼育係,円山動物園,開催予定,,環境局円山動物園飼育展示課,011-621-1426,,,
49,2020-01-09,2020-01-11,冬休み自由研究勉強会,下水道科学館,開催予定,https://sapporo-src.com/kagakukan/event/jan.html,下水道科学館,011-717-0046,,,
50,2020-01-09,2020-02-21,"さとらんど冬の遊び,①さとのそり山でそりすべり②バナナボート③トラクター遊覧車④のりのりチューブ⑤羊・やぎのえさやり","①～④風のはらっぱ,⑤ふれあい牧場","開催,①は１/9（土）～2/21（日)9時～16時、②～⑤は1/9(土）～1/17(日）の毎日と1/23～2/21の土･日曜、祝日。②～④は10時～15時、⑤は11時～12時、13時30分～15時",http://www.satoland.com/,サッポロさとらんど,011-787-0223,,,
51,2020-01-09,,リサイクルプラザ宮の沢冬休み親子教室（新聞紙でちぎり絵）,ちえりあ,未定,http://www.sapporo530.or.jp/,環境局環境事業部循環型社会推進課,011-211-2928,,,
52,2020-01-09,,書っ！パフォーマンス～大きな筆で字を書こう！,市民ギャラリー,開催,,札幌市民ギャラリー,011-271-5471,,,
53,2020-01-10,2020-01-11,雪と氷のワークショップin札幌,札幌市青少年科学館,中止,https://www.ssc.slp.or.jp,教育委員会生涯学習生涯学習推進課,011-211-3871,,,
54,2020-01-10,,リサイクルプラザ宮の沢冬休み親子教室（空きびんでスノードーム作り）,ちえりあ,未定,http://www.sapporo530.or.jp/,環境局環境事業部循環型社会推進課,011-211-2928,,,
55,2020-01-10,,成人式,"中央区：札幌パークホテル,白石区：札幌コンベンションセンター,豊平区：カナモトホール,その他の区：札幌ドーム",中止,https://www.city.sapporo.jp/shimin/shinko/seijin/kaisai.html,各区地域振興課,,,,
56,2020-01-11,,さとらんど羊毛講座,さとらんどセンター,開催,http://www.satoland.com/,サッポロさとらんど,011-787-0223,,,
57,2021-01-12,2021-01-28,市民参加によるアイヌ文様タペストリーの制作,"中央区民センター,2階　つどいＡ・Ｂ",開催,"http://www.city.sapporo.jp/shimin/ainushisaku/shisaku/shiminsanka-ainu-art-monument.html,",札幌市市民文化局市民生活部アイヌ施策課,011-211-2399,,,
58,2020-01-12,2020-01-28,ステップ出張相談会,ハローワークほか,開催,https://www.career-bank.co.jp/job/other/project/toyohira.html,保健福祉局総務部保護自立支援課,011-211-2992,,https://www.city.sapporo.jp/shimin/shinko/seijin/kaisai.html,蜷・玄蝨ｰ蝓滓険闊郁ｪｲ
59,2020-01-14,,市民ギャラリー美術映画会,市民ギャラリー,開催,,札幌市民ギャラリー,011-271-5471,,,
60,2020-01-14,,札幌脱出計画　キャリアプラン～ベンチャーVS大手企業～,オンライン,開催予定,http://sapporo-iju.jp/,株式会社パソナテック　東日本支社　札幌支店,011-252-3381,,,
61,2020-01-16,,シットスキー体験会,中島体育センター,開催予定,https://www.city.sapporo.jp/sports/syogai/event/r2sitski-biski-taikenkai.html,スポーツ局スポーツ部企画事業課,011-211-3044,,,
62,2020-01-16,,市民ギャラリー　冬休み子ども映画会,市民ギャラリー,開催,,札幌市民ギャラリー,011-271-5471,,,
63,2020-01-17,,市民ギャラリー　冬休み出張教室＆ワークショップ,市民ギャラリー,開催,,札幌市民ギャラリー,011-271-5471,,,
64,2020-01-17,,アイヌ文化体験講座　アイヌ文様刺繍,"東区民センター,（東区北11条東7丁目1-1）",開催予定,https://www.city.sapporo.jp/shimin/pirka-kotan/jp/kouza/index.html,札幌市アイヌ文化交流センター,011-596-5961,,,
65,2021-01-18,,水中ウオーキング体験会,白石温水プール,中止,,白石区保健福祉部健康・子ども課,011－811-1881,,,
66,2020-01-19,2020-01-24,市民ラン展～市民参加のランの展示会,百合が原緑のセンター,開催,,百合が原緑のセンター,011-772-3511,,,
67,2020-01-19,,冬の鉢花の病害虫防除,豊平公園緑のセンター,開催,,豊平公園緑のセンター,011-811-6568,,,
68,2021-01-20,,外国籍人材のオシゴト応援企画　パネルディスカッション,未定,開催予定,http://sapporo-iju.jp/,株式会社パソナテック　東日本支社　札幌支店,011-252-3381,,,
69,2021-01-20,,さっぽろん札幌解体新書～女子トーっく～,オンライン,開催予定,http://sapporo-iju.jp/,株式会社パソナテック　東日本支社　札幌支店,011-252-3381,,,
70,2020-01-23,,リユースプラザ：土曜簡単工作教室（新聞紙1枚で作るミニトートバッグ作り）,リユースプラザ,未定,http://www.reuseplaza.jp/event.html,環境局環境事業部循環型社会推進課,011-211-2928,,,
71,2020-01-24,2020-01-30,リサイクルプラザ宮の沢市民交流広場,リサイクルプラザ宮の沢,開催,http://www.sapporo530.or.jp/,環境局環境事業部循環型社会推進課,011-211-2928,,,
72,2020-01-24,,洋ランの育て方,百合が原緑のセンター,開催,,百合が原緑のセンター,011-772-3511,,,
73,2020-01-26,2020-02-14,福寿草と雪割草展～春を告げる雪国の妖精たち～,百合が原緑のセンター,開催,,百合が原緑のセンター,011-772-3511,,,
74,2020-01-29,,自家製堆肥の作り方と冬の家庭菜園講座,カナモトホール,開催予定,http://www.city.sapporo.jp/seiso/gomi/namagomi/taihi_seminar2.html,環境局環境事業部循環型社会推進課,011-211-2928,,,
75,2020-01-30,,自家製堆肥の作り方と冬の家庭菜園講座,ちえりあ,開催予定,http://www.city.sapporo.jp/seiso/gomi/namagomi/taihi_seminar2.html,環境局環境事業部循環型社会推進課,011-211-2928,,,
76,2021-01-30,2021-01-31,さっぽろんFest!,オンライン,開催予定,http://sapporo-iju.jp/,株式会社パソナテック　東日本支社　札幌支店,011-252-3381,,,
77,2020-02-04,2020-02-25,ステップ出張相談会,ハローワークほか,開催,https://www.career-bank.co.jp/job/other/project/toyohira.html,保健福祉局総務部保護自立支援課,011-211-2992,,,
78,2020-02-04,,自家製堆肥の作り方と冬の家庭菜園講座,手稲区民センター,開催予定,http://www.city.sapporo.jp/seiso/gomi/namagomi/taihi_seminar2.html,環境局環境事業部循環型社会推進課,011-211-2928,,,
79,2020-02-05,,自家製堆肥の作り方と冬の家庭菜園講座,北5条通ビル,開催予定,http://www.city.sapporo.jp/seiso/gomi/namagomi/taihi_seminar2.html,環境局環境事業部循環型社会推進課,011-211-2928,,,
80,2020-02-06,,自家製堆肥の作り方と冬の家庭菜園講座,南区民センター,開催予定,http://www.city.sapporo.jp/seiso/gomi/namagomi/taihi_seminar2.html,環境局環境事業部循環型社会推進課,011-211-2928,,,
81,2020-02-07,,第11回モエレ山爆走そり大会,モエレ沼公園,中止,,東区市民部地域振興課,011-741-2429,,,
82,2020-02-11,,バイスキー体験会,Fu's snow area,開催予定,https://www.city.sapporo.jp/sports/syogai/event/r2sitski-biski-taikenkai.html,スポーツ局スポーツ部企画事業課,011-211-3044,,,
83,2020-02-14,,リサイクルプラザ宮の沢エコ映画会,リサイクルプラザ宮の沢,開催,http://www.sapporo530.or.jp/,環境局環境事業部循環型社会推進課,011-211-2928,,,
84,3月上～中旬,,第20回グランドゴルフ大会,つどーむ,中止,,東区市民部地域振興課,011-741-2429,,,
85,12/13から3/28までの第２・第４日曜日,,さとらんどみそ作り体験,さとらんどセンター,開催,http://www.satoland.com/,サッポロさとらんど,011-787-0223,,,
86,12/19から3/20までの第３土曜日,,さとらんどこんにゃく作り体験,さとらんどセンター,開催,http://www.satoland.com/,サッポロさとらんど,011-787-0223,,,
87,12/26から3/27までの第４土曜日,,さとらんどとうふ作り体験,さとらんどセンター,開催,http://www.satoland.com/,サッポロさとらんど,011-787-0223,,,
88,"毎週土曜または日曜,2時間程度,（時間は各区による）",,ひとり親家庭学習支援ボランティア事業,区民センター等,"６月20日から,再開","http://kosodate.city.sapporo.jp/mokuteki/manabu/hitorioya/1346.html,http://satsuboren.or.jp/hitorioya/",子ども未来局子育て支援部子育て支援課,011-211-2988,,,
89,",未定,",,さっぽろ雪まつり,オンライン,オンライン開催,https://www.snowfes.com/,さっぽろ雪まつり実行委員会事務局,011-281-6400,,,
90,未定,,令和３年東区新年交礼会,ＡＮＡクラウンプラザホテル札幌（例年）,中止,,東区市民部地域振興課,011-741-2429,,,
91,未定,,瑞穂大学（厚別区高齢者教室）,厚別区役所会議室ほか,中止,http://www.city.sapporo.jp/atsubetsu/machi/mizuho.html,厚別区市民部地域振興課,011-895-2442,,,
92,未定,,札幌ジャズオーケストラ2020,札幌サンプラザコンサートホール,延期,https://www.kyobun.org/fes,札幌市民芸術祭実行委員会事務局,011-271-5822,,,
93,未定,,新堀聡子ピアノリサイタル,ふきのとうホール,延期,https://www.kyobun.org/fes,札幌市民芸術祭実行委員会事務局,011-271-5822,,,
94,未定,,東区年輪大学（高齢者教室）,東区民センターほか,中止,,東区市民部地域振興課,011-741-2429,,,
95,未定,,119ニューイヤーコンサート2021,札幌コンサートホールKitara（例年）,中止,,札幌市消防学校教務課校務係,011?616?2262,,,
96,未定,,札幌市中央卸売市場　市民感謝　消費拡大フェア,札幌市中央卸売市場,中止,http://www.sapporo-market.gr.jp/,札幌市中央卸売市場協会,011-611-3176,,,